{
    "$schema": "https://json-schema.org/draft/2020-12/schema",
    "$id": "solution.schema.0.0.1.json",
    "title": "Quantum Benchmarking Solution File Schema",
    "description": "Describes required fields for a valid solution file.",
    "required": [
        "solution_uuid",
        "problem_instance_uuid",
        "short_name",
        "creation_timestamp",
        "contact_info",
        "solution_data",
        "compute_hardware_type",
        "compute_details",
        "digital_signature",
        "$schema"
    ],
    "properties": {
        "$schema": {
            "title": "Schema URI",
            "desription": "A hyperlink to the schema that describes this JSON object.",
            "type": "string"
        },
        "solution_uuid": {
            "title": "Solution UUID",
            "description": "The UUID of the solution being submitted as a string in 8-4-4-4-12 format.",
            "type": "string",
            "pattern": "^[0-9a-f]{8}-[0-9a-f]{4}-[0-9a-f]{4}-[0-9a-f]{4}-[0-9a-f]{12}$"
        },
        "problem_instance_uuid": {
            "title": "Problem Instance UUID",
            "description": "The UUID of the problem instance that the solution is based on.",
            "type": "string",
            "pattern": "^[0-9a-f]{8}-[0-9a-f]{4}-[0-9a-f]{4}-[0-9a-f]{4}-[0-9a-f]{12}$"
        },
        "creation_timestamp": {
            "title": "Creation Timestamp",
            "description": "Timestamp in ISO 8601 format in UTC (note the `Z`).\n\nExamples:  \n`2022-12-25T18:00:02.223Z`,\n`2022-12-25T07:18:45Z`",
            "type": "string",
            "pattern": "^\\d{4}-\\d{2}-\\d{2}T\\d{2}:\\d{2}:\\d{2}(?:\\.\\d+)?Z$"
        },
        "short_name": {
            "title": "Short Name",
            "description": "A short string.  Not necessarily unique.",
            "type": "string"
        },
        "contact_info": {
            "title": "Point of Contact(s)",
            "description": "A list of name/email/institution objects.",
            "type": "array",
            "items": {
                "type": "object",
                "required": [
                    "name",
                    "email",
                    "institution"
                ],
                "properties": {
                    "name": {
                        "title": "Name",
                        "type": "string"
                    },
                    "email": {
                        "title": "Email",
                        "type": "string"
                    },
                    "institution": {
                        "title": "Institution/Organization",
                        "type": "string"
                    },
                    "other_info": {
                        "title": "Other Information",
                        "description": "An optional object with no required structure for the test performer to put other contact information or comments in.",
                        "type": "object"
                    }
                }
            }
        },
        "is_resource_estimate": {
            "title": "Is Resource Estimate",
            "description": "A boolean indicating whether the solution is an estimate of a solver's performance. If this field is not set, it is assumed to be false.",
            "type": "boolean"
        },
        "solution_data": {
            "title": "Solution Data",
            "description": "A list of objects describing the data.  Exact structure is TDB.  For large instances, a URL to the data is given.",
            "type": "array",
            "items": {
                "type": "object",
                "required": [
                    "instance_data_object_uuid",
                    "run_time"
                ],
                "properties": {
                    "instance_data_object_uuid": {
                        "title": "Instance Data Object UUID",
                        "description": "TODO: description",
                        "type": "string",
                        "pattern": "^[0-9a-f]{8}-[0-9a-f]{4}-[0-9a-f]{4}-[0-9a-f]{4}-[0-9a-f]{12}$"
                    },
                    "energy": {
                        "title": "Energy",
                        "description": "The Ground State Energy.",
                        "type": "number"
                    },
                    "energy_units": {
                        "title": "Energy Units",
                        "description": "units.  E.g., `kcal/mol`",
                        "type": "string"
                    },
                    "error_bound": {
                        "title": "Error Bound",
                        "description": "Bound on the absolute energy error.",
                        "type": "number",
                        "minimum": 0
                    },
                    "confidence_level": {
                        "title": "Confidence Level",
                        "description": "Probability that the absolute energy error is less than the error bound.",
                        "type": "number",
                        "minimum": 0,
                        "maximum": 1
                    },
                    "run_time": {
                        "title": "Wall Clock Runtime",
                        "description": "A breakdown of start/stop wall clock time(s) reported according to ISO 8601 in UTC and duration in seconds.  run_time is broken down into (1) overall_time, (2) preprocessing_time, (3), algorithm_run_time, and (4) postprocessing_time.  See descriptions of each object.",
                        "type": "object",
                        "required": [
                            "overall_time",
                            "preprocessing_time",
                            "algorithm_run_time",
                            "postprocessing_time"
                        ],
                        "properties": {
                            "overall_time": {
                                "title": "Overall Wall Clock Time",
                                "description": "Includes all pre/postprocessing times and algorithm_run_time.",
                                "type": "object",
                                "required": [
                                    "seconds"
                                ],
                                "properties": {
                                    "wall_clock_start_time": {
                                        "title": "Wall Clock Start Time",
                                        "description": "Timestamp in ISO 8601 format in UTC (note the `Z`).\n\nExamples:  \n`2022-12-25T18:00:02.223Z`,\n`2022-12-25T07:18:45Z`",
                                        "type": "string",
                                        "pattern": "^\\d{4}-\\d{2}-\\d{2}T\\d{2}:\\d{2}:\\d{2}(?:\\.\\d+)?Z$"
                                    },
                                    "wall_clock_stop_time": {
                                        "title": "Wall Clock Stop Time",
                                        "description": "Timestamp in ISO 8601 format in UTC (note the `Z`).\n\nExamples:  \n`2022-12-25T18:00:02.223Z`,\n`2022-12-25T07:18:45Z`",
                                        "type": "string",
                                        "pattern": "^\\d{4}-\\d{2}-\\d{2}T\\d{2}:\\d{2}:\\d{2}(?:\\.\\d+)?Z$"
                                    },
                                    "seconds": {
                                        "title": "Duration in Seconds",
                                        "description": "The number of seconds that has elapsed between start/stop times reported.",
                                        "type": "number",
                                        "minimum": 0
                                    }
                                }
                            },
                            "preprocessing_time": {
                                "title": "Preprocessing Wall Clock Time",
                                "description": "The time required to load any data into an idle machine before running an algorithm.",
                                "type": "object",
                                "required": [
                                    "seconds"
                                ],
                                "properties": {
                                    "wall_clock_start_time": {
                                        "title": "Wall Clock Start Time",
                                        "description": "Timestamp in ISO 8601 format in UTC (note the `Z`).\n\nExamples:  \n`2022-12-25T18:00:02.223Z`,\n`2022-12-25T07:18:45Z`",
                                        "type": "string",
                                        "pattern": "^\\d{4}-\\d{2}-\\d{2}T\\d{2}:\\d{2}:\\d{2}(?:\\.\\d+)?Z$"
                                    },
                                    "wall_clock_stop_time": {
                                        "title": "Wall Clock Stop Time",
                                        "description": "Timestamp in ISO 8601 format in UTC (note the `Z`).\n\nExamples:  \n`2022-12-25T18:00:02.223Z`,\n`2022-12-25T07:18:45Z`",
                                        "type": "string",
                                        "pattern": "^\\d{4}-\\d{2}-\\d{2}T\\d{2}:\\d{2}:\\d{2}(?:\\.\\d+)?Z$"
                                    },
                                    "seconds": {
                                        "title": "Duration in Seconds",
                                        "description": "The number of seconds that has elapsed between start/stop times reported.",
                                        "type": "number",
                                        "minimum": 0
                                    }
                                }
                            },
                            "algorithm_run_time": {
                                "title": "Algorithm Run Time",
                                "description": "The start/stop times for how long the software/algorithm ran.",
                                "type": "object",
                                "required": [
                                    "seconds"
                                ],
                                "properties": {
                                    "wall_clock_start_time": {
                                        "title": "Wall Clock Start Time",
                                        "description": "Timestamp in ISO 8601 format in UTC (note the `Z`).\n\nExamples:  \n`2022-12-25T18:00:02.223Z`,\n`2022-12-25T07:18:45Z`",
                                        "type": "string",
                                        "pattern": "^\\d{4}-\\d{2}-\\d{2}T\\d{2}:\\d{2}:\\d{2}(?:\\.\\d+)?Z$"
                                    },
                                    "wall_clock_stop_time": {
                                        "title": "Wall Clock Stop Time",
                                        "description": "Timestamp in ISO 8601 format in UTC (note the `Z`).\n\nExamples:  \n`2022-12-25T18:00:02.223Z`,\n`2022-12-25T07:18:45Z`",
                                        "type": "string",
                                        "pattern": "^\\d{4}-\\d{2}-\\d{2}T\\d{2}:\\d{2}:\\d{2}(?:\\.\\d+)?Z$"
                                    },
                                    "seconds": {
                                        "title": "Duration in Seconds",
                                        "description": "The number of seconds that has elapsed between start/stop times reported.",
                                        "type": "number",
                                        "minimum": 0
                                    },
                                    "compute_node_run_time_breakdown": {
                                        "title": "Compute Node Run Time Breakdown",
                                        "description": "Breakdown of algorithm_run_time across multiple nodes if a cluster of multiple machines was utilized.\n\nThis object is optional.  There is no required structure for this object."
                                    }
                                }
                            },
                            "postprocessing_time": {
                                "title": "Postprocessing Wall Clock Time",
                                "description": "The time required measure or read out any data from the machine.  .",
                                "type": "object",
                                "required": [
                                    "seconds"
                                ],
                                "properties": {
                                    "wall_clock_start_time": {
                                        "title": "Wall Clock Start Time",
                                        "description": "Timestamp in ISO 8601 format in UTC (note the `Z`).\n\nExamples:  \n`2022-12-25T18:00:02.223Z`,\n`2022-12-25T07:18:45Z`",
                                        "type": "string",
                                        "pattern": "^\\d{4}-\\d{2}-\\d{2}T\\d{2}:\\d{2}:\\d{2}(?:\\.\\d+)?Z$"
                                    },
                                    "wall_clock_stop_time": {
                                        "title": "Wall Clock Stop Time",
                                        "description": "Timestamp in ISO 8601 format in UTC (note the `Z`).\n\nExamples:  \n`2022-12-25T18:00:02.223Z`,\n`2022-12-25T07:18:45Z`",
                                        "type": "string",
                                        "pattern": "^\\d{4}-\\d{2}-\\d{2}T\\d{2}:\\d{2}:\\d{2}(?:\\.\\d+)?Z$"
                                    },
                                    "seconds": {
                                        "title": "Duration in Seconds",
                                        "description": "The number of seconds that has elapsed between start/stop times reported.",
                                        "type": "number",
                                        "minimum": 0
                                    }
                                }
                            }
                        }
                    }
                }
            }
        },
        "compute_hardware_type": {
            "title": "Compute Hardware Type",
            "description": "Type of device the algorithm is actually run on.  Choose from:\n\n`classical_computer` \n`quantum_computer` \n`hybrid_classical_quantum_computer` \n`other`.",
            "type": "string",
            "enum": [
                "classical_computer",
                "quantum_computer",
                "hybrid_classical_quantum_computer",
                "other"
            ]
        },
        "compute_details": {
            "title": "Compute Hardware & Software Details",
            "description": "Details on the hardware and software (algorithm) used by the test performer. Exact structure is TBD.",
            "type": "object"
        },
        "digital_signature": {
            "title": "Digital Signature",
            "description": "This is created by the benchmark performer and their private key.  It is calculated over the TBD object.  If this is not implemented, it may be set to null",
            "anyOf": [
                {
                    "type": "object"
                },
                {
                    "type": "null"
                }
            ]
        }
    },
    "if": {
        "required": ["is_resource_estimate"],
        "properties": {
            "is_resource_estimate": {
                "const": true
            }
        }
    },
    "then": {
        "properties": {
            "solution_data": {
                "items": {
                    "required": [
                        "error_bound",
                        "confidence_level"
                    ]
                }
            }
        }
    },
    "else": {
        "properties": {
            "solution_data": {
                "items": {
                    "required": [
                        "energy"
                    ]
                }
            }
        }
    }
}